id,clean_text,sentimen
762,bangun ikn suruh tanggung,negatif
763,aspal bisnis gratifikasi hiruk ijazah ikn istri kabar kabar kacau libat mantu mantu penuh sang tambang tenggelam,negatif
764,dewi ikn open sosok tunggu,negatif
765,emang ikn inap jajan kak kerja kerja pas proyek suka taun tim,negatif
766,bijak didik ikn insentif jamin keluarga layak pindah pusat risau sehat,negatif
767,hantu ikn mal ringan,negatif
768,biaya bikin ikn miris sono,negatif
769,ikn iman kalo lemah pindah takut,negatif
770,butuh ikn organik pindah,negatif
771,daerah ikn kudu negara,negatif
772,biar dukung dukung ikn putar uang,positif
773,ikn kerja lanjut proyek,negatif
774,ikn judi kalo kasino prostitusi pusat ubah,negatif
775,babi dosa dosa ikn indonesia makan orang semangat,negatif
